Topic,Chapter,Section,Subsection,Article,Content
,,,,70,"In accordance with Article 179(1)(a) of the CRR, estimates must be plausible and intuitive and must be based on the material drivers of the respective risk parameters. To comply with this requirement, institutions should have sufficient empirical evidence to justify situations where an obligor has an equal or better PD estimate than the third party providing support as a consequence of the treatments specified in paragraph 62(c) of the EBA GL on PD and LGD. In addition, differences between the various forms of contractual support should be considered in the PD models, unless there is sufficient empirical evidence that these differences are not relevant risk drivers. This understanding should also be taken into account if the rating of the third party is being considered as an indication for an override under paragraph 62(b) of the EBA GL on PD and LGD."
,,,,71,"In addition, in the situation described in paragraph 62(b) of the EBA GL on PD and LGD, where a rating of a third party is being taken into account as an indication for an override of the assignment of the relevant obligor to a grade or pool, institutions should not assign a rating to an obligor that is better than the rating of the third party as a consequence of an override resulting solely from the existence of this third-party support."
,,,,72,"Furthermore, when third-party support is used extensively in the scope of application of a PD model, institutions should consider its existence as a potential relevant driver for risk differentiation, in accordance with Section 4.1.2."
,,,4.1.5 Use of shadow rating models,,
,,,,73,"The ECB understands a shadow rating model (SRM) to be an internal rating approach that selects and weighs the risk drivers to be used for risk differentiation purposes by identifying the main factors that explain external ratings provided by an external credit assessment institution or similar organisation, rather than internal directly observed defaults."
,,,,74,"In accordance with Article 144(1)(e) of the CRR, institutions must document the rationale for their rating systems. To comply with this requirement, institutions should justify and document the rationale for the use (and the continued use) of the SRM, instead of the internal default prediction model, and also document the alternative approaches that have been considered, in accordance with Article 41 of the Final Draft RTS on assessment methodology for IRB. In addition, and without prejudice to the risk differentiation requirements, when developing the model institutions should set explicit threshold criteria in terms of capacity to explain the target ratings and take appropriate action when those thresholds are not met."
,,,,75,"Assignment criteria and processes must be periodically reviewed to determine whether they remain appropriate for the current portfolio and external conditions. To comply with this requirement, as part of the review of estimates institutions should take all reasonable steps to demonstrate how the model performs on the application population in terms of predicting defaults or, if that is not possible (when there are not enough internal default data), at least in terms of predicting the target ratings."
,,,,76,"In accordance with Article 170(1)(b) of the CRR, institutions' rating systems must have an obligor rating scale which reflects exclusively the quantification of the risk of obligor default. To this end, institutions should adjust the ratings used as targets for their SRMs if they do not solely embed default risk. They should also document such adjustments."
,,,,77,"In accordance with Article 174(1)(a) of the CRR, when an institution uses a statistical model and other mechanical methods to assign exposures to obligors or facilities, the input variables must form a reasonable and effective basis for the resulting predictions. To comply with this requirement, when the institution uses an SRM external ratings should not be used as risk drivers in addition to target variables."
,,,,78,"When assigning obligors and facilities to grades or pools institutions must take all relevant information into account. To comply with this requirement, when different information sources are used institutions should ensure that they understand the impact of any differences between these sources and establish adequate procedures to ensure that these differences are adequately addressed."
,,,,79,"Furthermore, the data used to build the model must be representative of the population of the institution's actual obligors or exposures. To comply with this requirement, institutions should analyse and provide evidence of the representativeness of the data used for model development consistently with paragraphs 20 to 27 of the EBA GL on PD and LGD."
,,4.2 PD risk quantification,,,
,,,4.2.1 Relevant regulatory references,,
,,,,80,"In accordance with Article 180(1) of the CRR, for exposures to corporates, institutions, central governments and central banks and for equity exposures, institutions must estimate PDs by obligor grade from the LRA of one-year default rates. In accordance with Article 180(2) of the CRR, for retail exposures, institutions must estimate PDs by obligor/facility grade or pool from LRAs of one-year default rates. To comply with these requirements, institutions should follow Sections 4.2.2 to 4.2.6 below."
,,,4.2.2 Calculation of observed average default rates,,
,,,,81,"For the calculation of the one-year default rate and observed average default rates, institutions should follow paragraphs 73 to 81 of the EBA GL on PD and LGD, also considering the following. (a) It is the understanding of the ECB that, for retail exposures and when the definition of default is applied at facility level, paragraphs 73 to 81 of the EBA GL on PD and LGD can be applied facility level. (b) Exposures for which there is no commitment (considering on-balance sheet exposures, off-balance sheet items and unadvised limits) at reference date should be excluded from the calculation of the default rate. Conversely, if there is an EAD estimate, then these exposures should be included in the calculation of the default rate."
,,,,82,"For the purpose of choosing an appropriate approach under paragraph 80 of the EBA GL on PD and LGD, it is the ECB's understanding that overlapping one-year time windows should preferably be used when the analysis performed by the institution under paragraphs 80(a), 80(b) and/or 80(d) of the EBA GL on PD and LGD reveals any of the following: (a) the proportion of short-term and terminated contracts and/or the respective distribution of default rates is not stable over time; (b) the observed average default rate using overlapping one-year time windows is significantly different from the observed average default rate using non-overlapping one-year time windows; (c) there is a significant variation between the observed average default rates calculated using non-overlapping one-year time windows on different reference calculation dates within a year."
,,,,83,"Institutions should estimate PDs taking their own internal data into consideration. In cases where institutions use external or pooled data series to complement their internal data for the purpose of PD estimation, the more internal default experience an institution has, the less importance it needs to give to external data. In addition, institutions should ensure that these external or pooled data series are representative in accordance with Section 3.2 of this guide. To comply with the requirement for the data to be representative and as part of their representativeness analysis, institutions should also ensure that the average observed default rates from external data or from the external part of the pooled data are calculated separately from, and compared with, those based on internal data. This comparison should be made at the levels at which the default rate is to be calculated. This means, in accordance with paragraph 79 of the EBA GL on PD and LGD, that the comparison should be made for each rating grade or pool and for the type of exposures covered by the relevant PD model, as well as for any relevant calibration segment. The direction and magnitude of the differences between these averages should be properly analysed and documented when calibrating the model, including the need and adequacy of the category A MoC considered with regard to paragraph 37(a)(viii) of the EBA GL on PD and LGD, and duly followed up in the review of estimates."
,,,4.2.3 Calibration to the LRA default rate,,
,,,,84,"To calculate the LRA default rate, institutions should follow paragraphs 82 to 86 of the EBA GL on PD and LGD. If an institution makes adjustments to the observed average default rates in order to obtain LRA default rates under paragraph 85(b) of the EBA GL on PD and LGD, these adjustments should be based on (external) default rates, or - if no appropriate default rates are available - on other observed indicators relevant for the type of exposures considered."
,,,,85,"For the purpose of assessing the representativeness of the historical observation period used for the likely range of variability of one-year default rates under paragraph 83 of the EBA GL on PD and LGD, the following should be taken into account. (a) Where the scarcity of internal exposures and/or defaults might unduly influence the variability of internally observed default rates (i.e. where the variability driven by statistical uncertainty is so high in comparison with the structural variability of default rates that it hampers any analysis of them), institutions should assess whether external or pooled default rate series can be used to identify the relevant historical observation period for the likely range of variability of one-year default rates. The external or pooled default series used should be relevant for the specific portfolio at least in terms of geographical composition, sectoral distribution and other relevant risk drivers. When no relevant default rate series can be identified, the items described in paragraphs 83(b) and 83(c) of the EBA GL on PD and LGD should play a crucial role in the assessment. (b) When taking into account the existence of one-year default rates relating to bad years as reflected in economic indicators that are relevant for the considered types of exposures within the historical observation period as referred to in paragraph 83(b) of the EBA GL on PD and LGD, institutions should ensure that such indicators are relevant for the portfolio at least in the terms of geographical composition, sectoral distribution and other risk drivers relevant to the portfolio."
,,,,86,"With respect to calibration to the LRA default rate, institutions should follow paragraphs 87 to 99 of the EBA GL on PD and LGD. If an institution chooses the approach referred to in paragraph 92(b) of the EBA GL on PD and LGD, it should perform additional tests as part of the development and ongoing monitoring of its models to ensure that the final (post-calibration) PDs reflect the LRA default rate of each grade. Specifically, institutions should ensure that there are no systematic deviations when comparing the estimated PDs with the LRA default rate of the grades, i.e. the direction of divergences across grades should be random."
,,,4.2.4 Weighting for retail exposures,,
,,,,87,"Notwithstanding paragraph 84, for retail exposures institutions need not give equal importance to historical data if more recent data are a better predictor of loss rates. In the understanding of the ECB an institution may consider that the more recent data are a better predictor of loss rates and may give more importance to recent historical data if the following apply. (a) There is a significant improvement in the predictive power when using the more recent data with respect to the predictive power resulting from the use of an arithmetic average under paragraph 81 of the EBA GL on PD and LGD. This improvement should be evidenced by comparing the estimated PDs for each grade with the realised default rates covering as long a period as possible, in accordance with Article 185(b) of the CRR. (b) Older data are considered as non-representative as a result of specific policy or business changes in the bank, but not in order to reflect current trends in default rates directly related to macroeconomic conditions. (c) The weighting approach is used in a consistent manner over time and any change in the applied weights of historical data is appropriately justified."
,,,4.2.5 PD quantification based on mapping to external grades,,
,,,,88,"The ECB interprets the possibility for institutions to attribute the default rate observed for the grades of a rating agency or similar organisation to its own grades in accordance with Article 180(1)(f) of the CRR as being equivalent to the use of external data for PD quantification at a more aggregated level (external grade) rather than at the obligor/facility level. Accordingly, Sections 3.2 and 4.2.2 of this chapter are relevant for institutions that do so."
,,,,89,"In accordance with Article 180(1)(f) of the CRR, mappings must be based on a comparison of internal rating criteria with the criteria used by the external organisation and on a comparison of the internal and external ratings of any common obligors. Biases or inconsistencies in the mapping approach or underlying data must be avoided. To comply with these requirements, institutions should follow the paragraphs listed below. 46 (a) Institutions should ensure that the quality of the mapping between internal and external rating scales at a given date and over time is consistent and provides for an adequate level of predictive ability. (b) When mapping internal grades to external grades, institutions should document and analyse any differences between the external and internal rating criteria. (c) The use of common obligors as a basis for the mapping should take into account their representativeness for the application portfolio. Article 180(2)(e) of the CRR. (d) Institutions should adjust the external rating scale if such rating scale does not solely embed default risk. They should also document such adjustments. (e) When mapping internal grades to external grades and using the default rates of the external grades provided by the organisation, if the latter has a material number of entities for which it no longer provides a rating (withdrawn rating), the institution should take this into account. It should adjust the external default rates accordingly, if necessary, and take into consideration the provisions of paragraph 75 of the EBA GL on PD and LGD. In the event that an adjustment is performed, the institution should add the necessary MoC."
,,,4.2.6 Specific requirements for direct PD estimates,,
,,,,90,"In order to use direct PD estimates for the calculation of own funds requirements in accordance with Article 169(3) of the CRR, institutions should follow paragraphs 96 and 98(b) of the EBA GL on PD and LGD. To assess whether the theoretical assumptions of the probability model underlying the estimation methodology are satisfied to a sufficient extent in practice under paragraph 96 of the EBA GL on PD and LGD, institutions should do the following. 47 (a) Ensure good risk differentiation properties across the full PD range of the rating system. (b) Have an adequate and documented concept in place specifying the calibration function currently implemented (concrete functional form), including the underlying theoretical assumptions and the established processes to conduct the PD calibration. It is the ECB's understanding that institutions should ensure consistency between the score-inferred PDs and the observed default rates and should understand and justify the transformation of the scores into PD values. (c) Ensure that any transformation of the scores resulting from the probability model that is applied during the calibration does not change the ranking of the obligors/facilities (in other words, co-monotonicity between scores/raw PDs and PD values should be ensured). Moreover, institutions should avoid any undue influence of extreme values of score-inferred PDs on the shape of the calibration function. Additionally, and when institutions use different calibration functions for different sub-ranges, they should ensure that this mix is appropriate (both in terms of the functional forms used and the cut-offs selected) and that it is appropriately justified. In accordance with Article 170(1)(b) of the CRR, institutions' rating systems must have an obligor rating scale which reflects exclusively the quantification of the risk of obligor default. (d) Ensure that there is a relevant number of observations across the whole range of score-inferred PDs. Particular interest should be paid to situations where the probability model is extended to ranges of PD values where there are not enough defaulted observations. (e) Ensure that there are no excessive concentrations of exposures or obligors within the PD range of the rating system. In addition, high concentrations of observations in a specific range of score-inferred PDs should be properly analysed and justified in terms of homogeneity. (f) For the purpose of performing the additional tests at grade level referred to in paragraph 92(b) of the EBA GL on PD and LGD, grades should be understood as sub-ranges of PD values. These sub-ranges should be defined in a way that: (i) represents sufficiently narrow ranges of PD values; (ii) contains a sufficient number of observations to ensure a meaningful calculation of the LRA default rate of the sub-range."
,,,,91,"In cases where institutions map the PDs to a masterscale (defined in terms of PD bounds) as a final step in the PD estimation process (using masterscale discrete PDs for the purpose of RWEA calculation), there is a risk that the mapping process could distort RWEAs. To mitigate this risk, institutions should verify that deviations between the masterscale PDs and the average of the direct PDs assigned to obligors in each grade do not show a systematic or material bias towards underestimation of PD per grade over time. This analysis should be provided for both the portfolio and for each grade."
,5 Loss given default,,,,
,,5.1 Realised LGD,,,
,,,5.1.1 Relevant regulatory references,,
,,,5.1.2 Reference dataset,,
,,,,92,"Under paragraph 102 of the EBA GL on PD and LGD, institutions should estimate LGDs on the basis of their own loss or recovery experience. Institutions may supplement their own historical data on defaulted exposures with external data. The more own loss experience (i.e. the more internal defaults) an institution has, the less importance it needs to give to external data. Institutions should ensure that their own historical experience contains a minimum number of defaults in order to determine whether external data are sufficiently representative."
,,,,93,"To ensure that LGD estimations are accurate and are not underestimated as a result of different external and internal recovery processes, institutions should place greater importance on comparisons of internal recovery processes with the recovery processes underlying the external data, in cases where a high weight is assigned to external data. Where limited representativeness of external data is found, a category A MoC should be considered, in order to reflect the uncertainty of the estimation under paragraph 37(a)(viii). Its magnitude should also be quantified in relation to the weight assigned to the external data."
,,,,94,"When institutions use information derived from the market price of defaulted financial instruments to supplement their internal loss or recovery experience data, there is a risk of misspecification of their LGD estimates. To mitigate this risk, institutions should ensure the following: (a) institutions should verify whether the development sample is representative of the application portfolio at least in terms of regions and product type, even when those variables have not been identified as relevant risk drivers; (b) losses derived from market prices should be increased to reflect indirect costs, as specified in paragraph 146 of the EBA GL on PD and LGD."
,,,5.1.3 Calculation of realised LGD,,
,,,,95,"Article 4(1)(55) of the CRR defines LGD as the ratio of the loss on an exposure due to the default of a counterparty to the amount outstanding at default. For the purposes of Article 181(1)(a) of the CRR, institutions are required to calculate realised LGD. To comply with this requirement, it is the ECB's understanding that institutions should calculate realised LGD under paragraphs 100 to 103 and 131 to 146 of the EBA GL on PD and LGD. In addition, when performing this calculation institutions should follow the observations in the succeeding paragraphs."
,,,,96,"In accordance with Article 181(1)(h) of the CRR, institutions must have estimates of LGD in-default and ELBE on defaulted exposures. To comply with this requirement, it is the ECB's understanding that all principles regarding the calculation of realised LGD should be applied for the estimation of LGD on nondefaulted exposures and for the estimation of LGD in-default and ELBE on defaulted exposures, unless mentioned otherwise (that is, if the reference date is considered instead of the date of default)."
,,,,97,"Where, in the case of retail exposures and purchased corporate receivables, institutions derive LGD estimates from realised losses and appropriate estimates of PDs in accordance with Articles 161(2) and 181(2)(a) of the CRR and under paragraph 103 of the EBA GL on PD and LGD, all the principles regarding realised LGD should apply to realised losses."
,,,,98,"Institutions must document the specific definitions of default and loss used internally and ensure that they are consistent with the definitions set out in the CRR. To comply with these requirements, institutions should have in place sufficiently detailed policies and procedures to ensure that the realised LGD is calculated consistently and accurately, including the implementation of the definition of economic loss. These policies and procedures should include sufficiently detailed documentation to allow third parties to replicate the calculation of realised LGD. To ensure that the policies and procedures are implemented in an appropriate and adequate manner, the calculation process should be regularly reviewed by an independent unit."
,,,,99,"In accordance with Article 181(1)(a) of the CRR and under paragraph 100 of the EBA GL on PD and LGD, institutions should calculate the realised LGD at facility level for each default. In exceptional cases, the ECB considers institutions to be compliant with the requirement to calculate realised LGD at facility level if they can prove that the recovery is not performed at individual facility level but at a more aggregated level (for example, several facilities of the same or different types secured by the same collateral). The realised LGD can therefore be calculated at a more aggregated level than individual facility level. For this exceptional deviation from the calculation of realised LGD at facility level to be acceptable, institutions should: 49 (a) provide evidence that recovery at aggregated level is legally enforceable. (b) on a regular basis (as often as review of estimates is performed or more often), provide evidence that recovery at a more aggregated level than single facility level is in practice enforced. This evidence should be based on the institution's historical practice and data and demonstrate that both the recovery process and its outcomes in terms of realised loss or recovery are the same for all the facilities considered at the aggregated level. Specifically, institutions should be able to prove that all collateral within an aggregation is called irrespective of the product triggering default (thus, for a current account as for a home loan) and that realised loss or observed recovery is the same for all types of facility within the aggregation. (c) for retail exposures where institutions use definition of default at facility level in accordance with the last sentence of Article 178(1) of the CRR, ensure that the default is triggered for all aggregated facilities. In addition, institutions following this approach should: (d) ensure that the parameters are applied in a manner that is consistent with how they have been estimated, i.e. across aggregated facilities; (e) ensure that the counting unit used for the purposes of risk quantification is at this aggregated level; (f) ensure that no bias results from the aggregation of facilities, by validating the estimates (PD, LGD, CCF) at the more aggregated level also."
