Topic,Chapter,Section,Subsection,Article,Content
,,,,39,"The use of pooled data is treated similarly to the situation where internal data are combined with data derived from a different (and external) set of obligors or facilities, as mentioned in Section 3.2."
,,,,40,"In accordance with Article 179(2)(a) of the CRR, where an institution uses data that are pooled across institutions the rating systems and criteria of other institutions in the pool must be similar to its own. To comply with this requirement an institution should, among other things: (a) ensure that there is a common definition of the key drivers and processes; (b) ensure that policies and procedures considered for human judgement, including overrides, can be applied in a comparable and similar manner across all participating institutions."
,,3.5 Use of purchased rating systems or models (pool models),,,
,,,,41,"In accordance with the last sentence of Article 144(1) of the CRR, the requirements to use an IRB approach, including own estimates and CCFs, apply also where an institution has implemented a rating system, or model used within a rating system, that it has purchased from a third-party vendor. To comply with this provision, institutions should ensure in such cases that all relevant internal information for model development and parameter calibration is taken into account. In particular, LRAs of default rates, LGD and CCFs based only on internal data should always be computed and considered for calibration. The institution remains responsible for the performance of the rating system or model."
,,,,42,"In addition, to ensure the integrity of the rating systems or internal models when institutions make use of pool models, and to comply with Article 144(1) of the CRR, the principles set out below should be followed. (a) If PD estimates are calculated using pooled data, institutions should verify that the data used for risk quantification meet the data requirements for default rate calculation as clarified in paragraph 80 below, or that the data are adjusted accordingly. (b) Where several institutions use a common pool model, each should ensure that its rating process is aligned to the extent that all input risk drivers are defined in the same way across all participating institutions. The institutions should also ensure that all assessments of the qualitative components of the rating model are performed in a comparable manner. (c) If a pool model is used for the estimation of risk parameters and the model-relevant parts of the process for managing distressed obligors (including the strategy before and after default) of the participating institutions are not aligned, these differences should be appropriately taken into account within the model or through an appropriate adjustment, in accordance with paragraph 37(a)(viii) of the EBA GL on PD and LGD. In the case of a pool model for the estimation of LGD parameters, differences in the model-relevant parts of the workout processes should also be taken into account within the model or through an appropriate adjustment. (d) Institutions should ensure that all relevant internal information with respect to the creditworthiness of an obligor is taken into account and the rating is updated with new information in a timely manner. (e) Each institution should remain responsible for the performance of the rating model on its own portfolio."
,,,,43,"To ensure that its ratings systems are operating properly on an ongoing basis, if an institution introduces systematic adjustments to the outputs of the pool model, the institution concerned should initiate internal procedures to analyse whether significant weaknesses in the model exist and whether a model change needs to be triggered."
,,3.6 Consistency in the definition of default,,,
,,,,44,"In accordance with Article 178(4) of the CRR, institutions that use external data that are not in themselves consistent with the definition of default laid down in paragraph 1 of that Article must make appropriate adjustments to achieve broad equivalence with the definition of default. To comply with this requirement, institutions should ensure that when they make use of external data or pooled data they have a complete understanding of the definition of default applied to these data and perform a comparison between the definition of default used and the requirements of Article 178 of the CRR. If there are differences between the definition of default applied in the external or pooled data and the institution's own definition of default, the institution should assess the differences and describe the adjustments made to the risk estimates, in order to achieve the required level of consistency with the internal definition of default. It should also include an appropriate MoC to account for the adjustments included. These adjustments should be appropriately documented and justified, in particular by providing reasonable assurance that they do not undermine the validity of the approach for the purposes of risk differentiation and risk quantification."
,,3.7 Use of human judgement,,,
,,,,45,"In accordance with Article 171(1)(a) of the CRR, institutions must have specific definitions, processes and criteria for assigning exposures to grades or pools. The grade and pool definitions must be sufficiently detailed. To comply with this provision, institutions should ensure that, when human judgement is used in the assignment of exposures to grades or pools, there is a framework in place that establishes clear and detailed guidelines and procedures on the application of human judgement (e.g. through the use of pre-defined questionnaires). The use of human judgement should be documented in a way that ensures the rating assignment can be understood and replicated by a third party. To ensure the replicability and consistency of the rating assignment process, the principles set out below should be followed. (a) The basic structure of the model should be applied consistently and not modified by human judgement. It should, in particular, consist of: (i) the minimum data sources to be used for the grade/pool assignment; (ii) the complete list of pre-defined risk drivers which need to be assessed individually and for which the assessments need to be stored; (iii) the importance of and the evaluation criteria for the risk drivers, particularly the functional relationship between risk drivers and the assigned rating (before overrides); (iv) the procedures and steps to be followed during the assessment, including the steps where overrides can be applied. (b) Institutions should assess the consistency of the rating assignment process. To this end, they should define the tests and analyses in a way that is proportionate to the degree of human judgement applied. In cases where human judgement is the main component of the rating assignment process, these tests should at least include an analysis of consistency in a representative sample by having obligors re-rated independently by different analysts. The results of the ratings consistency assessment should be analysed against pre-defined thresholds as part of the framework for review of estimates."
,,,,46,"In accordance with Article 172(3) of the CRR, for grade and pool assignments institutions must document the situations in which human judgement may override the inputs or outputs of the assignment process and the personnel responsible for approving these overrides. In the context of this requirement, the ECB understands that an override is a judgement-based and discretionary action that contributes to the assessment of the obligor's creditworthiness as obtained through pre-defined components of the rating system. These comprise both automatic/quantitative components and qualitative variables. An override constitutes a direct intervention to an input or to an intermediate or final output of the rating assignment process, through an adjustment or replacement of that input or intermediate/final output which is obtained under the regular assignment process. Overrides should be limited to information relevant to the obligor's creditworthiness, if this is not captured well by the predefined components of the model."
,,,,47,"Within a rating assignment process, the use of pre-defined risk drivers in the form of qualitative model inputs should be distinguished from overrides. These judgement-based or qualitative variables are expected to be considered under the regular assignment process and as part of the pre-defined components of the rating system. Therefore, they are not themselves considered as overrides."
,,,,48,"Whenever the functional relationship between the risk drivers and the assigned rating as specified in paragraph 45(a)(iii) is circumvented, for example in cases where the last-assigned rating deviates from the rating that would be assigned on the basis of this functional relationship, it is considered to be an override. For the purposes of Article 172(3) of the CRR, it should therefore be specified in the policies and criteria for the use of overrides in the rating assignment process."
,,,,49,"In accordance with Article 174(e) of the CRR, the results of the statistical model must be complemented by human judgement, especially by taking into account all information not included in the model. The higher the number of relevant observations, the more the institution should rely on the outcomes of the statistical model."
,,,,50,"In addition, when human judgement is used for the purpose of model development, for example in setting the model's assumptions, the identification of risk drivers and determination of their weights, or the identification and combination of model components, there is a risk of the model-based assignments being inaccurate. To mitigate this risk, institutions should ensure that the incorporation of human judgement is appropriately managed and proportionate to the number of relevant available observations."
,,,,51,"For the purposes of quantifying the risk parameters to be associated with grades or pools, estimates must not be based purely on judgemental considerations. To this end, where human judgement is used to a greater extent because of the low number of relevant available observations, institutions should apply a higher MoC to their estimates to account for additional uncertainty."
,,,,52,"In addition, whenever human judgement is used in the estimation of risk parameters (for either risk differentiation or risk quantification purposes) institutions are expected to have in place a framework under paragraph 35 of the EBA GL on PD and LGD."
,4 Probability of default,,,,
,,4.1 Structure of PD models,,,
,,,4.1.1 Relevant regulatory references,,
,,,,53,"In accordance with Article 179(1)(a) of the CRR, estimates must be based on the material drivers of the risk parameters. The relevant material risk drivers and rating criteria may be taken into consideration in several ways: (a) when assigning exposures to different PD models; (b) at a PD model level when assigning exposures to different ranking/scoring methods; (c) as explanatory variables in ranking/scoring methods; (d) as drivers in the process for the assignment of PDs to grades or pools (e.g. calibration segments)."
,,,,54,"When choosing the risk drivers for the models, there is a risk that risk drivers that capture the characteristics of defaulted obligors could be inappropriately inferred as relevant risk drivers for the portfolio. To mitigate this risk, institutions should take appropriate measures against model misspecification with regard to overfitting. This is particularly relevant where default data for the development of the model are scarce."
,,,,55,"In accordance with Article 144(1)(a) of the CRR, institutions' rating systems must provide for a meaningful assessment of obligor and transaction characteristics, a meaningful differentiation of risk and accurate and consistent quantitative estimates of risk. To comply with this requirement, it is the ECB's understanding that PD models should perform adequately on economically significant and material sub-ranges of application. The sub-ranges are identified by splitting the full range of application of the PD model into different parts on the basis of potential drivers for risk differentiation, including the following non-exhaustive list of drivers, where relevant: (a) for PD models covering exposures to small and medium-sized enterprises (SMEs): country, industry (e.g. statistical classification of economic activities in the European Community (abbreviated as NACE) code section classification A to U), size of obligor (e.g. different buckets in terms of total assets), past delinquency (e.g. obligors with delinquency events, i.e. days past due, in the last 12 months); (b) for PD models covering retail exposures: client type (e.g. high net worth/private banking, other individuals, self-employed, SMEs), product type (e.g. consumer credit, credit card, other), region (e.g. nomenclature of territorial units for statistics (NUTS) 1, 2 or 3 as defined by Eurostat), past delinquency (e.g. obligors with delinquency events, i.e. days past due, in the last 12 months), maturity (e.g. original or remaining maturity); (c) for PD models covering retail exposures secured by real estate: region (e.g. NUTS 1, 2 or 3 as defined by Eurostat), type of real estate (e.g. residential, commercial, other), past delinquency (e.g. obligors with delinquency events, i.e. days past due, in the last 12 months), maturity (e.g. original or remaining maturity); (d) for PD models covering exposures to financial institutions: business model (deposit-taking institutions, investment banking, insurance firms, other), jurisdiction (or global region as appropriate) and size (defined buckets of total assets); (e) for PD models covering exposures to large corporates: industry (e.g. NACE code section classification A to U), country (or global region as appropriate) and size (defined buckets of total turnover)."
,,,,56,"In accordance with Article 169(1) of the CRR, where an institution uses multiple rating systems, the rationale for assigning an obligor or a transaction to a rating system must be documented and applied in a manner that appropriately reflects the level of risk. To comply with this requirement institutions should, in terms of the range of application of a PD model: (a) clearly describe its range of application (and sub-divisions into different ranking/scoring methods and calibration segments) and also include an explanation of the risk drivers which the institution considered when designing the process but has decided not to use for the assignment of the obligor to the rating system; (b) ensure that there are no overlaps in the range of application of different PD models and that each obligor or facility to which the IRB approach should be applied can be clearly assigned to one particular PD model."
,,,4.1.2 Risk differentiation,,
Principles for all model types,,,,,
,,,,57,"Article 170 of the CRR lays down requirements related to the structure of rating systems. To comply with these requirements and with reference to Articles 36 to 38 of the Final Draft RTS on assessment methodology for IRB, institutions should, among other things, ensure a meaningful differentiation of risk over time which takes into account (i) the distribution of obligors or facilities; (ii) the homogeneity of obligors or facilities assigned to the same grade or pool; and (iii) the different levels of risk across obligors or facilities assigned to different grades or pools to which a different PD is applied."
,,,,58,"To ensure that the PD model performs adequately in terms of risk differentiation, institutions should adopt the following approach. (a) Define metrics (considering both their evolution over time and specific reference dates) with well-specified targets, taking into account tolerance levels that reflect the uncertainty of the metrics, and take action, where necessary, to rectify any deviations from these targets that exceed the tolerance levels. Separate targets and tolerances may be defined for initial development and ongoing performance. (b) Ensure that the tools used to assess risk differentiation are sound and adequate considering the available data. The risk differentiation is expected to be demonstrated on time series of realised default rates for grades or pools under different economic conditions."
Principles specific for grades and pools,,,,,
,,,,59,"A grade or pool is understood by the ECB as the subset of obligors or facilities to which the same PD is applied for the calculation of regulatory capital requirements, irrespective of how this PD has been assigned (e.g. through the use of masterscales)."
Distribution of obligors or facilities across grades or pools,,,,,
,,,,60,"Articles 170(1)(c) and (d) and 170(3)(b) and (c) of the CRR require, among other things, that the number of grades and pools is adequate to achieve meaningful risk differentiation and quantification of the PD at the grade or pool level. To comply with this requirement, institutions should: (a) justify the criteria applied when determining the number of grades or pools and the proportion of obligors or facilities assigned to each; (b) ensure that the concentration of numbers of obligors or facilities is not excessive in any grade or pool; any significant concentrations should be supported by convincing empirical evidence of the homogeneity of risk for those obligors or facilities; (c) ensure that no grade or pool has too few obligors or facilities, unless this is supported by convincing empirical evidence of the adequacy of the grouping of the exposures in question."
Homogeneity within grades,,,,,
,,,,61,"Articles 170(1)(b) and (d) and 170(3)(b) and (c) of the CRR require, among other things, that the structure of rating systems must ensure the homogeneity of obligors or facilities assigned to the same grade or pool. In accordance with this requirement and under paragraph 69 of the EBA GL on PD and LGD: (a) homogeneity is understood as obligors or facilities assigned to a grade having a reasonably similar default risk to ensure that the grade-level default rate is representative of all obligors or facilities in that grade; (b) in cases where it is found (through the use of additional drivers or a different discretisation of the existing ones) that a material subset of obligors or facilities within a grade/pool yields a significantly different default rate to that of the rest of the grade or pool, this is considered to indicate a lack of homogeneity."
Risk differentiation across grades or pools,,,,,
,,,,62,"To comply with the requirement to ensure adequate risk differentiation across grades or pools, institutions should ensure that there are no significant overlaps in the distribution of the default risk between grades or pools. This should be ensured through a meaningful differentiation of the default rates of each grade."
Principles specific for direct estimates,,,,,
,,,,63,See paragraph 90.
,,,4.1.3 Grade assignment dynamics,,
,,,,64,"In order to ensure a meaningful assessment of obligor characteristics, when assigning obligors or facilities to a grade or pool institutions should follow paragraphs 66 to 68 of the EBA GL on PD and LGD. Although the time horizon used in PD estimation is one year, it is the ECB's understanding that the rating/grade/pool assignment process should also adequately anticipate and reflect risk over a longer time horizon and take into account plausible changes in economic conditions. In order to achieve this objective: (a) all relevant information should be included in the rating/grade/pool assignment process, giving an appropriate balance between drivers that are predictive only over a short time horizon and drivers that are predictive over a longer time horizon; (b) a horizon of two to three years is considered to be appropriate for most portfolios; (c) in accounting for plausible changes in economic conditions, the institution should consider at least past observed default patterns; (d) the model should perform under different economic conditions. As a consequence of the above, institutions' grade assignment dynamics should also adequately anticipate and reflect in the assignment of grades the risk over the longer time horizon. For clarity, this does not mean that grades remain stable over the longer time horizon in the event of changes in the risks that are specific to the obligor."
,,,,65,"Additionally, the following principles apply under the specific situations considered in (a) to (c) below:  (a) when using external scores or ratings (e.g. from an external bureau or external rating agency) as drivers for the purpose of risk differentiation within a specific model, institutions should identify the grade assignment dynamics embedded in the external rating and understand the effect on their own grade assignment dynamics, considering the other risk drivers used; (b) when using external ratings as target variables for the purpose of risk differentiation within a specific model (see Section 4.1.5), institutions should preserve their own grade assignment dynamics by taking the appropriate measures when necessary; (c) when mapping internal grades to external grades in order to use external default rates to estimate PD, institutions should ensure that the grade assignment dynamics of the external ratings are sufficiently similar to their own internal grade assignment dynamics, or perform the necessary adjustments during risk quantification to compensate for any differences."
,,,4.1.4 Use of ratings of third parties,,
,,,,66,"In accordance with Article 172(1)(a) of the CRR, institutions must assign each obligor to a grade or pool as part of the credit approval process. To comply with this requirement, institutions should have a clear policy specifying the conditions under which the rating of a third party which has a contractual or organisational relationship with an obligor of the institution (third-party support) may be taken into account in the risk assessment of that obligor. This policy should meet the following criteria. (a) It should specify in which situations the rating of a parent entity could be taken into account in the risk assessment of other entities of the group. In particular, the policy should specify those situations in which obligors are assigned to a better grade than their parent entities. (b) It should include provisions on the use of ratings of third parties that provide contractual support to more than one obligor. As a general rule, the policy should include, but not be limited to, possible prioritisation, eligibility, and the impact on the rating of the supporting third party."
,,,,67,"Articles 201 to 203 of the CRR establish requirements for the eligibility of unfunded credit protection. To comply with these requirements, institutions may recognise the guarantee by applying the risk weight of the guarantor under the standardised approach to the covered part of the exposure, provided that no own estimates of LGD and CCFs are used (foundation IRB (F-IRB)). This applies when an obligor is guaranteed by a third party that is not in the range of application of a PD model and the guarantee fulfils all requirements for credit risk mitigation (CRM), consistently with paragraph 44 of the EBA Report on the CRM Framework. In such situations, under paragraph 74 of the EBA GL on PD and LGD, the guaranteed obligor should be included in the calculation of the one-year default rate of the grade the obligor is assigned to, before the recognition of the guarantee."
,,,,68,"In addition, when the institution reflects substitution effects arising from CRM in the ratings assigned to a material number of exposures within a rating system, there is a risk that the process of assigning exposures to grades or pools might not provide for a meaningful differentiation of risk, as a result of the inclusion of obligors with significantly different risk levels within the same rating grade. To mitigate this risk, institutions should verify that obligors guaranteed by a third party do not carry a significantly different level of risk from those in the same rating grade without such a guarantee, and that no separate calibration segment as referred to in paragraph 97 of the EBA GL on PD and LGD is required."
,,,,69,"When, under paragraph 62(a) of the EBA GL on PD and LGD, an institution performs a rating transfer across different rating systems that do not share the same obligor rating scale, it should ensure that the mapping between rating scales is performed in such a way that the final PD estimate (including MoC) assigned to the guaranteed exposure amount is not better than the final PD estimate (including MoC) being transferred from a third party. Article 171(2) of the CRR establishes that information used to assign obligors and facilities to grades or pools must be current. To comply with this requirement, if a material proportion of exposures or obligors within a rating system receives a rating from another IRB rating system as a result of rating transfers, institutions should ensure that the transferred ratings are automatically updated when the rating of the third party changes or when the PDs of the rating system to which the third party belongs are re-estimated."
