Topic,Chapter,Section,Subsection,Article,Content
,1 Scope of the credit risk chapter,,,,
,,,,1,"The purpose of this chapter is to provide transparency on how the ECB understands a number of topics related to internal models used for the IRB approach, including an initial section covering data maintenance for this approach. It is important to note that this chapter does not aim to cover exhaustively all topics of the CRR for the IRB approach that could be subject to review during internal model investigations. On these selected topics, the chapter is aligned with the EBA GL on PD and LGD."
,2 Data maintenance for the IRB approach,,,,
,,2.1 Relevant regulatory references,,,
,,,,2,"In accordance with Article 144(1) of the CRR, an institution's systems for the management and rating of credit risk exposures must be sound and implemented with integrity. In particular, the institution must collect and store all relevant data to provide effective support to its credit risk measurement and management processes. The ECB understands that, in order to comply with these requirements, institutions should deploy robust, well-documented and adequately tested IT systems, together with sound data management practices."
,,,,3,"Consequently, this section of the guide sets out the principles regarding the following elements for the management of IRB data: (a) IT systems: infrastructure and implementation testing; (b) policies, roles and responsibilities in data processing and data quality management; (c) components of the data quality management framework."
,,2.2 IT systems: infrastructure and implementation testing,,,
,,,2.2.1 Infrastructure,,
,,,,4,"Sound and robust IT infrastructures play an essential role in supporting the institution's rating systems. In addition, and in accordance with Article 175(1) of the CRR, institutions must document the design and operational details of their rating systems."
,,,,5,"With regard to the soundness and robustness of institutions' IT infrastructure, the ECB considers that Article 78(2) and (3) of the Final Draft RTS on assessment methodology for IRB provides a good understanding of the elements that institutions should take into account in order to comply with the data-related requirements of the CRR."
,,,,6,"Furthermore, to comply with the documentation requirements for the rating systems as established under Article 144(1)(e) and Article 175(1) of the CRR, it is the ECB's view that institutions should document and keep an updated register of all current and past versions of the following elements of a rating system: (a) the model's data flow (from data entry to reporting and for both historical data and current exposure data), identifying the relevant workflows and procedures relating to data extraction, data collection, data storage and data transformations; (b) the relevant sources of data and the global map of IT systems and databases involved in the calculation systems used for the purposes of the IRB approach; (c) the relevant functional specification of IT systems and databases, including their size, date of construction and data dictionaries, specifying the content of the fields and of the different valid data values that could be inserted in them, with clear definitions of data items; (d) the relevant technical specification of IT systems and databases, including the type of database, tables, database management system, database architecture, and data models given in any standard data modelling notation; (e) the audit trail for critical IT systems and databases. To allow an independent knowledgeable third party to obtain a detailed outline of the different IT elements of the rating systems, the documentation produced by the institution should be clear and understandable. To comply with the requirement to document its rating system and the rationale for its design, the institution should keep the register of all rating systems, including all current and past versions of rating systems, updated for a period of at least three years and, whenever necessary, an extended period beyond that. This is also reflected in Article 33(1) of the Final Draft RTS on assessment methodology for IRB. In any case, the institution should ensure that the elements mentioned in paragraph 6(a) to (e) for the current rating system are adequately recorded in the register and enable a clear understanding of all relevant data of the current rating system that must be stored by the institution."
,,,2.2.2 Implementation testing,,
,,,,7,"In order to ensure the integrity and robustness of IT systems and in particular that, in terms of IT, the implementation of the models is successful and errorfree, institutions should have in place a consistent process for testing the relevant IRB systems and applications upon first implementation and on an ongoing basis. This IT-testing process should be clearly defined and documented in an organisation-wide policy and procedure."
,,,,8,"To achieve its objective the policy should consider all potential events that should trigger a testing procedure and their impact on the tests to be conducted. The trigger events that should be considered include: software releases or material IT-related changes, regulatory changes, model methodology changes and the extension of the range of application of a rating system."
,,,,9,"IT implementation tests to be considered include the following: (a) unit/component/module tests; (b) integration tests (of units and between systems); (c) system tests (this includes functionality, performance - in normal and stress scenarios and security and portability tests); (d) user acceptance testing (functional testing); (e) regression testing."
,,,,10,"In principle, the unit(s) responsible for performing the implementation tests should be clearly identified and the results of the tests should be documented. It is the ECB's view that as a general rule institutions should develop a standardised format for the documentation of test results."
,,"2.3 Policies, roles and responsibilities in data processing and data quality management",,,
,,,,11,"For institutions to be able to comply with the requirement to collect and store all relevant data established under Article 144(1)(d) of the CRR, it is the ECB's understanding that policies and rules on data management should be defined at group level for both of the following aspects: data processing (i.e. data collection, storage, validation, migration, actualisation and use), and data quality management (see Section 2.4 of this chapter)."
,,,,12,"As for data processing, and in particular with regard to manual interventions and data transfers, the following principles should be considered: (a) to ensure that all data transformations are traceable and controlled, general guidelines and rules should be clearly formalised with regard to manual interventions within the data processing; (b) to ensure timeliness and accountability, all data transfers should be formally agreed upon (for example by means of service level agreements) by data providers and data users (for both outsourced and in-house processes)."
,,,,13,"To ensure the integrity of the data processes, the policies and rules on data management should clearly set out the relevant data governance arrangements. It is also expected that these policies and rules will specify the different roles and responsibilities assigned to data management. These include data quality roles and responsibilities for both business owners and IT functions and data and systems ownership throughout the entire credit risk modelling life cycle (including all IT systems used). These policies should take into account the following principles. (a) The responsibilities of business owners include: (i) ensuring data are correctly entered, kept up-to-date and aligned with the institution's data definitions; (ii) ensuring that data aggregation capabilities and reporting practices are consistent with the institution's policies (b) IT functions are responsible for supporting the operation of the systems for data collection, processing, transformation and storage during the entire life cycle of the data. (c) Different business owners and IT systems owners may be appointed throughout the data life cycle. However, each data source, IT system and process step should have an assigned business owner and/or IT systems owner that can be formally identified."
,,2.4 Data quality management framework,,,
,,,,14,"Institutions must have in place a process for vetting data inputs into the model. This must include an assessment of the accuracy, completeness and appropriateness of the data. To comply with this requirement and to ensure the quality of the data used for credit risk measurement and management processes, it is the ECB's view that institutions should establish and implement an effective data quality management framework that is formalised in a set of policies and procedures. This framework should be applicable to all data used in IRB-related processes, i.e. internal data, external data and pooled data, if any. In addition, it should ensure that reliable risk information is available to enable an institution's risk profile to be assessed accurately and drive sound decision-making within the institution and by external stakeholders, including competent authorities."
,,,,15,"The ECB considers that the data quality management framework is effective when it encompasses the following components: (a) sound underlying governance principles (see Section 2.4.1 of this chapter), particularly those relating to the allocation and fulfilment of roles and responsibilities for the management of data quality in a manner that ensures that data quality management activities are independent of data processing activities; (b) a description of the scope in terms of risk data coverage (see Section 2.4.2); (c) data quality standards covering all relevant data quality dimensions, i.e. completeness, accuracy, consistency, timeliness, uniqueness, validity, availability and traceability (see Section 2.4.3); (d) consistent criteria and a systematic metrics approach to assess compliance with data quality standards; this should be supported by sufficient data quality controls along the entire IRB data chain (see Section 2.4.4); (e) procedures for constantly assessing and improving the quality of data (see Section 2.4.5); (f) reporting procedures on data quality allowing for sufficient understanding of the quality of the data supporting the IRB models (see Section 2.4.6). The following sections further develop the above-mentioned elements."
,,,2.4.1 Governance principles for the data quality management framework,,
,,,,16,"The data quality management framework: (a) should be approved by the institution's management body or a designated committee thereof and senior management as part of their responsibilities; (b) should be distributed throughout the organisation to the relevant staff; (c) should be regularly assessed in order to verify its adequacy, and be updated and improved whenever necessary; (d) should be subject to regular review by the internal audit function or another comparable independent auditing unit."
,,,,17,"The roles of the different units, internal bodies and staff involved in the data quality management process should be defined in such a way as to ensure that the data handling process is sufficiently independent of the data quality management process."
,,,,18,"The ECB considers it good practice for institutions to have a dedicated independent unit with an overall view of and responsibility for the management of data quality. Where an independent unit is established, the size of this unit should be proportionate to the nature, size and degree of complexity of the institution's business and organisational structure."
,,,2.4.2 Scope of the data quality management framework,,
,,,,19,"The data quality management framework: (a) should cover all relevant data quality dimensions: completeness, accuracy, consistency, timeliness, uniqueness, validity, availability and traceability (see paragraph 21); (b) should cover the whole data life cycle, from data entry to reporting, and encompass both historical data and current application databases."
,,,,20,"If institutions use data provided by third parties, the ECB considers it good practice for them to ensure that the third party has data quality processes in place to ensure the accuracy, completeness and appropriateness of the data provided."
,,,2.4.3 Data quality standards in the data quality management framework,,
,,,,21,"In accordance with Article 174(b) of the CRR, institutions must implement a process for vetting data inputs into the model which must include an assessment of the accuracy, completeness and appropriateness of data. The ECB understands that, in order to comply with this requirement, institutions should establish data quality standards that set the objectives and overall scope of the data quality management process. To this end, these standards should be defined for the following data quality dimensions for all data inputs into the model and at each stage of the data life cycle: (a) completeness (values are present in any attributes that require them); (b) accuracy (data are substantively error-free); (c) consistency (a given set of data can be matched across the institution's different data sources); (d) timeliness (data values are up-to-date); (e) uniqueness (aggregate data are free from any duplication arising from filters or other transformations of source data); (f) validity (data are founded on an adequate and rigorous classification system that ensures their acceptance); (g) availability/accessibility (data are made available to the relevant stakeholders); (h) traceability (the history, processing and location of the data under consideration can be easily traced)."
,,,2.4.4 Data quality controls,,
,,,,22,Data quality should be measured in an integrated and systematic way. The measurement system and the frequency of its application should be formalised.
,,,,23,Indicators and their corresponding tolerance levels and thresholds should be set in order to monitor compliance with the standards established and should be combined with visual systems (e.g. red/amber/green traffic-light system) and dashboards for monitoring and reporting purposes.
,,,,24,"Indicators should be supported by effective and sufficient data quality checks and controls throughout the data life cycle, from data entry to reporting, and for both historical data and current application data. Data quality checks and controls should include reconciliation across and within systems, including between accounting and IRB data. An effective control framework should therefore be in place to ensure that sound controls and related procedures are implemented, especially for manual processes."
,,,2.4.5 Remediation of data quality issues,,
,,,,25,A process for the identification and remediation of data quality deficiencies should be in place in order to constantly improve data quality and promote compliance with the data quality standards.
,,,,26,"Data quality assessments should be carried out independently (see paragraphs 17 and 18) and recommendations should be issued with an indication of their priority, based on the materiality of the incidents identified. All such data quality incidents should be recorded and monitored. For each of the data quality incidents, an owner responsible for resolving the incident should be appointed and an action plan for dealing with the incident drawn up on the basis of the priority assigned. Remediation timelines should depend on the severity and impact of the incident and the implementation timelines required to resolve it. Data quality incidents should be resolved at source level or, if this is not possible, mitigated by taking a prudent approach."
,,,2.4.6 Data quality reporting,,
,,,,27,"In accordance with Article 189(2)(c) of the CRR, the institution's senior management must ensure, on an ongoing basis, that the ratings systems are working properly. To accomplish this, the ECB understands that a formal reporting process on the quality of risk data should be in place with the objective of improving the quality of data and enabling an assessment of the potential impact of data quality in own fund requirements calculations. In general, this reporting should be presented in a standardised format with clear and concise content, including the following: (a) comprehensive overview of the performance of the model in terms of data quality, including external data and pooled data, if any, at all stages of the IRB life cycle, from data entry to reporting, for both historical data and current exposure data; (b) findings and, where applicable, recommendations to address detected weaknesses or shortfalls; (c) sufficient and appropriate evidence that the recommendations have been adequately addressed and properly implemented (e.g. by means of a status report). From the source system in which the incidents are present down to the IRB datasets or systems."
,,,,28,"In accordance with Article 189(1) of the CRR, the management body or a designated committee thereof and senior management must possess a general understanding of the rating systems of the institution and a detailed comprehension of its associated management reports. To comply with this requirement, the ECB understands that reports on the quality of risk data should be submitted to these parties. In addition, the ECB considers it good practice for these reports to also be submitted to all other relevant staff, including modellers, internal validation, internal audit, data quality managers, data owners and other business units involved."
,,,,29,"Data quality reports should be produced and submitted to senior management more frequently than annually to enable senior management to ensure, on an ongoing basis, that the rating systems are operating properly in accordance with Article 189(2)(c) of the CRR."
,3 Use of data,,,,
,,3.1 Relevant regulatory references,,,
,,,,30,"In accordance with Article 144(1)(d) of the CRR, institutions must collect and store all relevant data to provide effective support to their credit risk measurement and management processes. Furthermore, good data quality is a fundamental condition for developing a robust rating system. The ECB considers that, to comply with these requirements and ensure the quality of data, institutions should have sound policies, processes and methods in place, under paragraphs 15 to 34 of the EBA GL on PD and LGD for assessing and improving the quality and representativeness of the data used in the modelling and risk quantification process."
,,,,31,"Since the data-related requirements of the CRR also apply in cases where an institution estimates CCFs, paragraph 30 is also relevant for such institutions."
,,3.2 Use of external data,,,
,,,,32,"Data-related requirements established under the CRR apply to all data: internal, external or pooled. In the ECB's understanding, therefore, paragraph 30 is also relevant in the event that an institution uses external or pooled data. The principles on the collection and storage of data are relevant to the institutions' own data and to the data received from the pool."
,,,,33,"To ensure that credit risk management and measurement processes are built on appropriate data, for the purposes of risk differentiation, risk quantification and review of estimates institutions should assess whether external data can be used to complement internal data when they consider they do not have sufficient available internal data."
,,,,34,"In addition, when institutions use different data sources (including different external databases, whether or not combined with internal data) for the purpose of risk quantification, there could be a risk that the sources include common obligors among the data sources used for risk quantification. This could lead to bias or double-counting effects in the calculation of one-year default rates. To avoid this risk, institutions should develop the necessary processes in order to identify common obligors within these databases and ensure that each common obligor is only taken into account once in the calculation of one-year default rates. When institutions are not able to identify common obligors, they should analyse potential bias or double-counting effects in the calculation of one-year default rates. These bias or double-counting effects should be reflected appropriately in the computation of one-year default rates and long-run average (LRA) default rates."
,,,,35,"If an institution uses statistical models and other mechanical methods to assign exposures to obligors or facilities grades or pools, the data used to build the model must be representative of the population of the institution's actual obligors or facilities. If external data are used, the same requirements with regard to representativeness must be applicable vis-a-vis the bank's portfolio or portfolio subset for which the external data are used."
,,,,36,"Proving representativeness in cases where an institution uses external data is generally more difficult, as internal data are scarce. If an institution cannot provide sufficient proof that the external data are representative, in the ECB's view it may still use external data if it shows (by quantitative analysis and/or qualitative argumentation) that the information gained from the use of the external data outweighs any drawbacks stemming from the deficiencies identified and an appropriate margin of conservatism (MoC) is applied. In particular, institutions should provide evidence that the model's performance does not deteriorate when including information derived from the external data, and that the parameter estimates are not biased. To assess these issues, the institution should conduct quantitative and qualitative analyses specifically designed for this purpose."
,,,,37,"In accordance with Article 174(b) of the CRR, if an institution uses statistical models and other mechanical methods to assign exposures to obligors or facilities grades or pools, it must have in place a process for vetting data inputs to the model, which should include an assessment of the accuracy, completeness and appropriateness of the data. In addition, and in accordance with Article 179(1)(a), in quantifying the risk parameters to be associated with rating grades or pools institutions must incorporate all relevant data, information and methods. To comply with these requirements, institutions should ensure that, when external data are used for risk differentiation, risk quantification or review of estimates, they know the data sources and the most relevant data processing operations of the variables acting as direct model inputs performed by the data provider. Institutions should be able to differentiate between internal and external data and to document which information is internal and which information is received from external data sources. To ensure that the data remain appropriate, institutions should provide an adequate rationale in the event that, for the purpose of risk differentiation, risk quantification or review of estimates, they modify the external data acquired, select only part of a wider external database or use different external providers."
,,3.3 Use of external bureau scores or external ratings as input variables in the rating process,,,
,,,,38,"Where an institution uses external credit bureau scores or external ratings as input variables in the rating process, and in particular when externally sourced scores are the main (or one of the main) input variable(s) of the overall internal rating, there is a risk that an internal model may not consider all relevant information. In the ECB's understanding, institutions mitigate this risk when they comply with the following principles. (a) The external scores or ratings and/or data are regularly updated or refreshed, especially where credit bureau information is dynamic and is used not only for the application rating but also for the ongoing behavioural rating. (b) Institutions understand the structure and nature of external scores or ratings and their key drivers. They also regularly verify that the results of the credit bureau score continue to be appropriate input variables in their credit rating process, for example by reviewing any changes in the credit bureau score methodology. The greater the importance of the external scores or ratings, the greater understanding institutions should demonstrate of their structure, nature and key drivers and the higher the frequency that should be considered in monitoring the appropriateness of these external scores or ratings. (c) Validation requirements are similar to those applied to other internal and external input variables. (d) Even when the external score or rating is the main (or one of the main) driver(s) of the internal rating, the institution ensures that all relevant internal information regarding the creditworthiness of the obligor is taken into account with sufficient weighting in the internal rating. In addition, the institution demonstrates that the additional relevant internal information considered in the model and its weighting are sufficient to ensure that the internal rating does not merely take on the results of the external bureau scores or the external ratings used. (e) When institutions make use of external scores or ratings or any other judgement-based assessment provided by a third party as input variables in the rating process, they should ensure that any potential correlation between the relevant risk drivers does not lead to bias or a doublecounting effect in the risk parameter estimates. This can be especially relevant in these cases, due to the potential use of duplicated information. (f) The institution remains responsible for the performance of the model."
,,3.4 Use of pooled data,,,
